Handle,Title,Body (HTML),Vendor,Product Category,Type,Tags,Published,Option1 Name,Option1 Value,Option1 Linked To,Option2 Name,Option2 Value,Option2 Linked To,Option3 Name,Option3 Value,Option3 Linked To,Variant SKU,Variant Grams,Variant Inventory Tracker,Variant Inventory Qty,Variant Inventory Policy,Variant Fulfillment Service,Variant Price,Variant Compare At Price,Variant Requires Shipping,Variant Taxable,Variant Barcode,Image Src,Image Position,Image Alt Text,Gift Card,SEO Title,SEO Description,Google Shopping / Google Product Category,Google Shopping / Gender,Google Shopping / Age Group,Google Shopping / MPN,Google Shopping / Condition,Google Shopping / Custom Product,Google Shopping / Custom Label 0,Google Shopping / Custom Label 1,Google Shopping / Custom Label 2,Google Shopping / Custom Label 3,Google Shopping / Custom Label 4,Featured Ingredients (product.metafields.custom.featured_ingredients),How to Use (product.metafields.custom.how_to_use),Specific Item Info (product.metafields.custom.specific_item_info),Why We Love It (product.metafields.custom.why_we_love_it),Product rating count (product.metafields.reviews.rating_count),Active ingredient (product.metafields.shopify.active-ingredient),Color (product.metafields.shopify.color-pattern),Constitutive ingredients (product.metafields.shopify.constitutive-ingredients),Dispenser type (product.metafields.shopify.dispenser-type),Fragrance level (product.metafields.shopify.fragrance-level),Moisturizer type (product.metafields.shopify.moisturizer-type),Package type (product.metafields.shopify.package-type),Product certifications & standards (product.metafields.shopify.product-certifications-standards),Product form (product.metafields.shopify.product-form),Skin care effect (product.metafields.shopify.skin-care-effect),Skin care features (product.metafields.shopify.skin-care-features),Skin care mask type (product.metafields.shopify.skin-care-mask-type),Suitable for skin type (product.metafields.shopify.suitable-for-skin-type),Target gender (product.metafields.shopify.target-gender),Complementary products (product.metafields.shopify--discovery--product_recommendation.complementary_products),Related products (product.metafields.shopify--discovery--product_recommendation.related_products),Related products settings (product.metafields.shopify--discovery--product_recommendation.related_products_display),Search product boosts (product.metafields.shopify--discovery--product_search_boost.queries),Variant Image,Variant Weight Unit,Variant Tax Code,Cost per item,Included / United States,Price / United States,Compare At Price / United States,Included / International,Price / International,Compare At Price / International,Status
3ce-fitting-mesh-cushion,A’pieu Mint Scalp Hair Vinegar 200ml,,3CE,Health & Beauty > Personal Care > Cosmetics > Makeup > Face Makeup,Powder & Pact,,TRUE,Color,W05 (+Refill),,,,,,,,,0,shopify,100,deny,manual,28.7,41,TRUE,TRUE,,https://cdn.shopify.com/s/files/1/0668/2555/2008/files/80748728-ccd9-4da2-8a18-8d67d01ae276_bf959d4e-bc5a-4c6a-a7ac-9236ed95fba3.jpg?v=1742858854,1,,FALSE,,,,,,,,,,,,,,Contains 73% skincare ingredient for easy skin care.,"<img style=""display: block; margin-left: auto; margin-right: auto"" src=""https://cdn.shopify.com/s/files/1/0668/2555/2008/files/82d43508-698f-4670-85bb-954aa26e1c55.jpg?v=1741206122"" alt="""">","<div class=""modal-body type-inner-scroll""><div class=""modal-contents""><!----> <div class=""modal-cont-box type02""><div class=""prd-description""><table class=""table prd-desc-tbl""><colgroup><col class=""col01""> <col class=""col02""></colgroup> <tbody id=""descTbody""><tr><th scope=""row"">Content volume or weight</th> <td>Original Product 11g, Refill 11g</td></tr><tr><th scope=""row"">Ideal for</th> <td>Looking smooth and flawless all day long with the fitting essence! For even tone, smooth texture and radiance and more #3CEFittingMeshCushion</td></tr><tr><th scope=""row"">Expiration date (or expiration date after opening)</th> <td>36 months from the date of manufacture, 12 months after opening</td></tr><tr><th scope=""row"">How to Use</th> <td>Take an appropriate amount in the puff, smooth along the texture of the skin and lightly pat over the face to finish.<br></td></tr><tr><th scope=""row"">Cosmetics manufacturers, cosmetics responsible distributors, and customized cosmetics sellers</th> <td>Kolmar Korea Co., Ltd / Stylenanda Co., Ltd</td></tr><tr><th scope=""row"">Country of Manufacture</th> <td>South Korea</td></tr><tr><th scope=""row"">Ingredients</th> <td>Water,Titanium Dioxide,Methyl Trimethicone,Butylene Glycol,Silica,C12-15 Alkyl Benzoate,Dimethicone,Caprylic/Capric Triglyceride,Caprylyl Methicone,Glycerin,Cetyl PEG/PPG-10/1 Dimethicone,Dimethicone/Vinyl Dimethicone Crosspolymer,Magnesium Sulfate,Pentylene Glycol,PEG-10 Dimethicone,Synthetic Fluorphlogopite, Isododecane,Polyhydroxystearic Acid,Caprylyl Glycol,Alumina,Stearic Acid,Triethoxycaprylylsilane,Aluminum Hydroxide,Disteardimonium Hectorite,Propylene Carbonate,Pentaerythrityl Tetra-di-t-butyl Hydroxyhydrocinnamate,Fragrance,Phenoxyethanol,Iron Oxide Yellow,Iron Oxide Red,Iron Oxide Black,Linalool,Geraniol</td></tr><tr><th scope=""row"">MFDS Evaluation of Functional Cosmetics</th> <td>N</td></tr><tr><th scope=""row"">Precautions when using</th> <td>1) Consult a specialist if you have abnormal symptoms or side effects such as a skin rash, swelling, or itchiness during use or from exposure to direct sunlight after use.<br>2) Do not use on wounds or other affected areas.<br>3) Cautions for Storage and Handling<br>a) Keep out of reach of children.<br>b) Keep away from direct sunlight.</td></tr><tr><th scope=""row"">Quality Assurance Standard</th> <td>Compensation for defective products is provided according to the criteria for the settlement of consumer disputes notified publicly by the Fair Trade Commission.</td></tr><tr><th scope=""row"">Customer Service</th> <td>+82-502-707-8888</td></tr></tbody></table></div></div></div></div>",Made with SPF 40 PA+++ formula.The fitting essence in the cushion provides 24-hour lasting smooth coverage for perfect skin tone and glow.The fitting essence solution provides 24-hour lasting filter effect on skin.,,,,,,,,,,,,,,,,,,,,https://cdn.shopify.com/s/files/1/0668/2555/2008/files/2593b3fd-21fe-45cc-9dd7-f155578e7480_747a73bc-1e77-4508-92fd-de5f04990c8d.jpg?v=1742858854,lb,,,TRUE,,,TRUE,,,active
,A'pieu Juicy Pang Jelly Tint 3.5g,,,,,,,,,,,,,,,,,,,,,,,,,,,,,,,,,,,,,,,,,,,,,,,,,,,,,,,,,,,,,,,,,,,,,,,,,,,,,
,Abib Heartleaf Crème Calming Tube 75mL 1+1 Special Set,,,,,,,,,,,,,,,,,,,,,,,,,,,,,,,,,,,,,,,,,,,,,,,,,,,,,,,,,,,,,,,,,,,,,,,,,,,,,
,Abib Jericho Rose Bifida Serum Firming Drop 50mL Special Set (+30mL),,,,,,,,,,,,,,,,,,,,,,,,,,,,,,,,,,,,,,,,,,,,,,,,,,,,,,,,,,,,,,,,,,,,,,,,,,,,,
,Abib Sedum Hyaluron Pad Hydrating Touch 75 Pads (+75Pads Refill),,,,,,,,,,,,,,,,,,,,,,,,,,,,,,,,,,,,,,,,,,,,,,,,,,,,,,,,,,,,,,,,,,,,,,,,,,,,,
,_2022 Awards_ Abib Heartleaf Spot Pad Calming Touch 80ea Set (80+80 Pads),,,,,,,,,,,,,,,,,,,,,,,,,,,,,,,,,,,,,,,,,,,,,,,,,,,,,,,,,,,,,,,,,,,,,,,,,,,,,
,_2024 Awards_Abib Sedum Hyaluron Pad Hydrating Touch 75 Pads (+75Pads Refill +Moisture Grass Sticker 1 sheet),,,,,,,,,,,,,,,,,,,,,,,,,,,,,,,,,,,,,,,,,,,,,,,,,,,,,,,,,,,,,,,,,,,,,,,,,,,,,
,AESTURA Atobarrier365 Cream 80ml Double Set (+Cera-Hyal Moisture Ampoule 7ML+A-cica Serum 3ML),,,,,,,,,,,,,,,,,,,,,,,,,,,,,,,,,,,,,,,,,,,,,,,,,,,,,,,,,,,,,,,,,,,,,,,,,,,,,
,AESTURA Atobarrier365 Hydro Cera-HA Ampoule 30ml+15ml,,,,,,,,,,,,,,,,,,,,,,,,,,,,,,,,,,,,,,,,,,,,,,,,,,,,,,,,,,,,,,,,,,,,,,,,,,,,,
,AESTURA Atobarrier 365 Hydro Essence 200ml,,,,,,,,,,,,,,,,,,,,,,,,,,,,,,,,,,,,,,,,,,,,,,,,,,,,,,,,,,,,,,,,,,,,,,,,,,,,,
,AESTURA Atobarrier 365 Lotion 150mL,,,,,,,,,,,,,,,,,,,,,,,,,,,,,,,,,,,,,,,,,,,,,,,,,,,,,,,,,,,,,,,,,,,,,,,,,,,,,
,AESTURA Derma UV365 Vita-C Radiance Sunscreen 40ml Set (+20ml),,,,,,,,,,,,,,,,,,,,,,,,,,,,,,,,,,,,,,,,,,,,,,,,,,,,,,,,,,,,,,,,,,,,,,,,,,,,,
,AESTURA Regederm365 Retinoid Eye Serum 15ml,,,,,,,,,,,,,,,,,,,,,,,,,,,,,,,,,,,,,,,,,,,,,,,,,,,,,,,,,,,,,,,,,,,,,,,,,,,,,
,AESTURA THERACNE 365 Active Serum 30mL Special Set (+Cleansing Foam 30g + Toner 25mL),,,,,,,,,,,,,,,,,,,,,,,,,,,,,,,,,,,,,,,,,,,,,,,,,,,,,,,,,,,,,,,,,,,,,,,,,,,,,
,AHC Youth Lasting Real Eye Cream For Face 35mL,,,,,,,,,,,,,,,,,,,,,,,,,,,,,,,,,,,,,,,,,,,,,,,,,,,,,,,,,,,,,,,,,,,,,,,,,,,,,
,AHC Triple Hyaluronic Mask Sheet 25mL 10P,,,,,,,,,,,,,,,,,,,,,,,,,,,,,,,,,,,,,,,,,,,,,,,,,,,,,,,,,,,,,,,,,,,,,,,,,,,,,
,AHC Pro Shot Eye Cream For Face 30ml Special Set (+Serum 10ml),,,,,,,,,,,,,,,,,,,,,,,,,,,,,,,,,,,,,,,,,,,,,,,,,,,,,,,,,,,,,,,,,,,,,,,,,,,,,
,AHC Only For Man Pore Fresh All In One Essence 2-for-1 Special Set,,,,,,,,,,,,,,,,,,,,,,,,,,,,,,,,,,,,,,,,,,,,,,,,,,,,,,,,,,,,,,,,,,,,,,,,,,,,,
,AHC Nude Tone Up Cream Natural Glow 40mL,,,,,,,,,,,,,,,,,,,,,,,,,,,,,,,,,,,,,,,,,,,,,,,,,,,,,,,,,,,,,,,,,,,,,,,,,,,,,
,AHC 365 Red Serum Wrapping Modeling 40g,,,,,,,,,,,,,,,,,,,,,,,,,,,,,,,,,,,,,,,,,,,,,,,,,,,,,,,,,,,,,,,,,,,,,,,,,,,,,
,AIDA Glutathione Milk Oil Cleanser 150g,,,,,,,,,,,,,,,,,,,,,,,,,,,,,,,,,,,,,,,,,,,,,,,,,,,,,,,,,,,,,,,,,,,,,,,,,,,,,
,AMPLE:N Blemi Shot Ampoule 50mL,,,,,,,,,,,,,,,,,,,,,,,,,,,,,,,,,,,,,,,,,,,,,,,,,,,,,,,,,,,,,,,,,,,,,,,,,,,,,
,AMPLE:N Blemi Shot Ampoule 50ml 1+1 Set,,,,,,,,,,,,,,,,,,,,,,,,,,,,,,,,,,,,,,,,,,,,,,,,,,,,,,,,,,,,,,,,,,,,,,,,,,,,,
,Anua Peach 77 Niacin Essence Toner 250ml,,,,,,,,,,,,,,,,,,,,,,,,,,,,,,,,,,,,,,,,,,,,,,,,,,,,,,,,,,,,,,,,,,,,,,,,,,,,,
,Anua Peach 77 Niacin Enriched Cream 50ml,,,,,,,,,,,,,,,,,,,,,,,,,,,,,,,,,,,,,,,,,,,,,,,,,,,,,,,,,,,,,,,,,,,,,,,,,,,,,
,Anua Niacinamide 10%+TXA 4% Dark Spot Correcting Serum 30ml Special Set (+PDRN Hyaluronic Capsule 100 Serum 5ml),,,,,,,,,,,,,,,,,,,,,,,,,,,,,,,,,,,,,,,,,,,,,,,,,,,,,,,,,,,,,,,,,,,,,,,,,,,,,
,Anua Heartleaf Quercetinol Pore Deep Cleansing Foam 150ml (+25ml),,,,,,,,,,,,,,,,,,,,,,,,,,,,,,,,,,,,,,,,,,,,,,,,,,,,,,,,,,,,,,,,,,,,,,,,,,,,,
,Anua Heartleaf Pore Control Cleansing Oil 200mL Double Set,,,,,,,,,,,,,,,,,,,,,,,,,,,,,,,,,,,,,,,,,,,,,,,,,,,,,,,,,,,,,,,,,,,,,,,,,,,,,
,Anua Heartleaf Cream Mask Night Solution 1ea,,,,,,,,,,,,,,,,,,,,,,,,,,,,,,,,,,,,,,,,,,,,,,,,,,,,,,,,,,,,,,,,,,,,,,,,,,,,,
,Anua Heartleaf 80 Moisture Soothing Ampoule Mask 10ea,,,,,,,,,,,,,,,,,,,,,,,,,,,,,,,,,,,,,,,,,,,,,,,,,,,,,,,,,,,,,,,,,,,,,,,,,,,,,
,Anua Heartleaf 77% Soothing Toner 350mL + Heartleaf 70% Daily Relief Lotion 200mL,,,,,,,,,,,,,,,,,,,,,,,,,,,,,,,,,,,,,,,,,,,,,,,,,,,,,,,,,,,,,,,,,,,,,,,,,,,,,
,Anua Heartleaf 70 Daily Lotion 200ml,,,,,,,,,,,,,,,,,,,,,,,,,,,,,,,,,,,,,,,,,,,,,,,,,,,,,,,,,,,,,,,,,,,,,,,,,,,,,
,Arencia Blue Hyssop Rice Mochi Cleanser 120g,,,,,,,,,,,,,,,,,,,,,,,,,,,,,,,,,,,,,,,,,,,,,,,,,,,,,,,,,,,,,,,,,,,,,,,,,,,,,
,Arencia Fresh Cloud Body & Scalp Scrub (Black Tea & Yuzu) 260g,,,,,,,,,,,,,,,,,,,,,,,,,,,,,,,,,,,,,,,,,,,,,,,,,,,,,,,,,,,,,,,,,,,,,,,,,,,,,
,Arencia Holy Hyssop Serum 30 50g Set (+Spatula Pack Brush),,,,,,,,,,,,,,,,,,,,,,,,,,,,,,,,,,,,,,,,,,,,,,,,,,,,,,,,,,,,,,,,,,,,,,,,,,,,,
,Arencia Holy Hyssop Sheet Mask 4ea Set (+1ea),,,,,,,,,,,,,,,,,,,,,,,,,,,,,,,,,,,,,,,,,,,,,,,,,,,,,,,,,,,,,,,,,,,,,,,,,,,,,
,Arencia Rosehip Rice Mochi Cleanser 120g,,,,,,,,,,,,,,,,,,,,,,,,,,,,,,,,,,,,,,,,,,,,,,,,,,,,,,,,,,,,,,,,,,,,,,,,,,,,,
,ARIUL 7 Days Mask Sheet Greentea S_10+5,,,,,,,,,,,,,,,,,,,,,,,,,,,,,,,,,,,,,,,,,,,,,,,,,,,,,,,,,,,,,,,,,,,,,,,,,,,,,
,ARIUL 7 Days Mask Sheet Tea Tree M_10+5,,,,,,,,,,,,,,,,,,,,,,,,,,,,,,,,,,,,,,,,,,,,,,,,,,,,,,,,,,,,,,,,,,,,,,,,,,,,,
,Ariul All Green Feminine Wipes 40 Flushable Wipes,,,,,,,,,,,,,,,,,,,,,,,,,,,,,,,,,,,,,,,,,,,,,,,,,,,,,,,,,,,,,,,,,,,,,,,,,,,,,
,Ariul Apple Cider Deep Cleansing Oil 200mL Special Set (Free Gift: Cleansing Oil 100mL),,,,,,,,,,,,,,,,,,,,,,,,,,,,,,,,,,,,,,,,,,,,,,,,,,,,,,,,,,,,,,,,,,,,,,,,,,,,,
,[CINNAMOROLL EDITION] Ariul Apple Cider Deep Cleansing Oil 200ml Set (+CINNAMOROLL Handy Tok),,,,,,,,,,,,,,,,,,,,,,,,,,,,,,,,,,,,,,,,,,,,,,,,,,,,,,,,,,,,,,,,,,,,,,,,,,,,,
,[NEW] Ariul Smooth & Pure Foot Peeling Mask Sheet 2P Special Set,,,,,,,,,,,,,,,,,,,,,,,,,,,,,,,,,,,,,,,,,,,,,,,,,,,,,,,,,,,,,,,,,,,,,,,,,,,,,
,"AROMATICA Body Wash Refill Choose 1 out of 2 options_Enbrace, Serene",,,,,,,,,,,,,,,,,,,,,,,,,,,,,,,,,,,,,,,,,,,,,,,,,,,,,,,,,,,,,,,,,,,,,,,,,,,,,
,AROMATICA Eucalyptus Essential Oil 10ml,,,,,,,,,,,,,,,,,,,,,,,,,,,,,,,,,,,,,,,,,,,,,,,,,,,,,,,,,,,,,,,,,,,,,,,,,,,,,
,AROMATICA Frankincense Essential Oil 10ml,,,,,,,,,,,,,,,,,,,,,,,,,,,,,,,,,,,,,,,,,,,,,,,,,,,,,,,,,,,,,,,,,,,,,,,,,,,,,
,AROMATICA Inspirit Body Wash Basil & Bergamot 300ml,,,,,,,,,,,,,,,,,,,,,,,,,,,,,,,,,,,,,,,,,,,,,,,,,,,,,,,,,,,,,,,,,,,,,,,,,,,,,
,AROMATICA Pure & Soft Feminine Mist Clary Sage & Tea Tree 50mL,,,,,,,,,,,,,,,,,,,,,,,,,,,,,,,,,,,,,,,,,,,,,,,,,,,,,,,,,,,,,,,,,,,,,,,,,,,,,
,AROMATICA Pure & Soft Feminine Perfume 5ml #Sensual Floral 5ml,,,,,,,,,,,,,,,,,,,,,,,,,,,,,,,,,,,,,,,,,,,,,,,,,,,,,,,,,,,,,,,,,,,,,,,,,,,,,
,AROMATICA Pure & Soft Feminine Perfume 5ml #Sweet Fruity,,,,,,,,,,,,,,,,,,,,,,,,,,,,,,,,,,,,,,,,,,,,,,,,,,,,,,,,,,,,,,,,,,,,,,,,,,,,,
,AROMATICA Pure & Soft Feminine Wash Chamomile & Tea Tree 170mL,,,,,,,,,,,,,,,,,,,,,,,,,,,,,,,,,,,,,,,,,,,,,,,,,,,,,,,,,,,,,,,,,,,,,,,,,,,,,
,AROMATICA Rosemary Hair Thickening Conditioner 180mL Double Set,,,,,,,,,,,,,,,,,,,,,,,,,,,,,,,,,,,,,,,,,,,,,,,,,,,,,,,,,,,,,,,,,,,,,,,,,,,,,
,AROMATICA Rosemary Root Enhancer 100mL+100mL Double Set,,,,,,,,,,,,,,,,,,,,,,,,,,,,,,,,,,,,,,,,,,,,,,,,,,,,,,,,,,,,,,,,,,,,,,,,,,,,,
,AROMATICA Rosemary Scalp Scaling Shampoo 180mL,,,,,,,,,,,,,,,,,,,,,,,,,,,,,,,,,,,,,,,,,,,,,,,,,,,,,,,,,,,,,,,,,,,,,,,,,,,,,
,AROMATICA Vitalizing Rosemary All-In-One Wash 300mL,,,,,,,,,,,,,,,,,,,,,,,,,,,,,,,,,,,,,,,,,,,,,,,,,,,,,,,,,,,,,,,,,,,,,,,,,,,,,
,AROMATICA Wooden Scalp Brush M,,,,,,,,,,,,,,,,,,,,,,,,,,,,,,,,,,,,,,,,,,,,,,,,,,,,,,,,,,,,,,,,,,,,,,,,,,,,,
,Aromatica Mellowness Oil-in Body Wash 290ml Set (+Body Cream 50g),,,,,,,,,,,,,,,,,,,,,,,,,,,,,,,,,,,,,,,,,,,,,,,,,,,,,,,,,,,,,,,,,,,,,,,,,,,,,
,BANILA CO Clean It Zero Pore Clarifying Cleansing Balm 100ml Set (+Miniature Kit 7ml*4ea),,,,,,,,,,,,,,,,,,,,,,,,,,,,,,,,,,,,,,,,,,,,,,,,,,,,,,,,,,,,,,,,,,,,,,,,,,,,,
,BANILA CO Clean It Zero Pore Clarifying Cleansing Balm 100mL,,,,,,,,,,,,,,,,,,,,,,,,,,,,,,,,,,,,,,,,,,,,,,,,,,,,,,,,,,,,,,,,,,,,,,,,,,,,,
,BANILA CO Essence Skin Pink Cushion Puff 5P,,,,,,,,,,,,,,,,,,,,,,,,,,,,,,,,,,,,,,,,,,,,,,,,,,,,,,,,,,,,,,,,,,,,,,,,,,,,,
,Beauty of Joseon Relief Sun: Rice + Probiotics (SPF50+ PA++++) Double Pack 50mL*2ea,,,,,,,,,,,,,,,,,,,,,,,,,,,,,,,,,,,,,,,,,,,,,,,,,,,,,,,,,,,,,,,,,,,,,,,,,,,,,
,Beauty of Joseon Clear Rice pH-Balanced Cleansing Bar 100g,,,,,,,,,,,,,,,,,,,,,,,,,,,,,,,,,,,,,,,,,,,,,,,,,,,,,,,,,,,,,,,,,,,,,,,,,,,,,
,belif Super Knights Multi Vitamin Mask 75mL,,,,,,,,,,,,,,,,,,,,,,,,,,,,,,,,,,,,,,,,,,,,,,,,,,,,,,,,,,,,,,,,,,,,,,,,,,,,,
,belif UV Protector Aqua Bomb Sun Serum 50ml,,,,,,,,,,,,,,,,,,,,,,,,,,,,,,,,,,,,,,,,,,,,,,,,,,,,,,,,,,,,,,,,,,,,,,,,,,,,,
,belif UV Protector Multi Sunscreen 50mL,,,,,,,,,,,,,,,,,,,,,,,,,,,,,,,,,,,,,,,,,,,,,,,,,,,,,,,,,,,,,,,,,,,,,,,,,,,,,
,BIODANCE Bio Collagen Gel Toner Pad 60P Set (+4P),,,,,,,,,,,,,,,,,,,,,,,,,,,,,,,,,,,,,,,,,,,,,,,,,,,,,,,,,,,,,,,,,,,,,,,,,,,,,
,B.READY Cicaffeine Trouble Reset Toner 250mL,,,,,,,,,,,,,,,,,,,,,,,,,,,,,,,,,,,,,,,,,,,,,,,,,,,,,,,,,,,,,,,,,,,,,,,,,,,,,
,B.READY Cicaffeine Trouble Reset Serum 40mL,,,,,,,,,,,,,,,,,,,,,,,,,,,,,,,,,,,,,,,,,,,,,,,,,,,,,,,,,,,,,,,,,,,,,,,,,,,,,
,B.READY Cicaffeine Trouble Reset Cream 70mL,,,,,,,,,,,,,,,,,,,,,,,,,,,,,,,,,,,,,,,,,,,,,,,,,,,,,,,,,,,,,,,,,,,,,,,,,,,,,
,BANILA CO Clean It Zero Original Cleansing Balm 100ml Set (+Miniature Kit 7ml*4ea),,,,,,,,,,,,,,,,,,,,,,,,,,,,,,,,,,,,,,,,,,,,,,,,,,,,,,,,,,,,,,,,,,,,,,,,,,,,,
,Cell Fusion C Water Fit Tone-Up Sun Base SPF50+/PA++++ 40ml,,,,,,,,,,,,,,,,,,,,,,,,,,,,,,,,,,,,,,,,,,,,,,,,,,,,,,,,,,,,,,,,,,,,,,,,,,,,,
,Cell Fusion C Clear Tone-Up Sun Base SPF50+/PA++++ 40ml,,,,,,,,,,,,,,,,,,,,,,,,,,,,,,,,,,,,,,,,,,,,,,,,,,,,,,,,,,,,,,,,,,,,,,,,,,,,,
,Cell Fusion C Post _ Centecassol Ointment 40ml,,,,,,,,,,,,,,,,,,,,,,,,,,,,,,,,,,,,,,,,,,,,,,,,,,,,,,,,,,,,,,,,,,,,,,,,,,,,,
,Centellian24 Medeca Homme 2pcs Special Set (Toner 150mL + After-shave Cream 50mL + Cleansing Foam 50mL),,,,,,,,,,,,,,,,,,,,,,,,,,,,,,,,,,,,,,,,,,,,,,,,,,,,,,,,,,,,,,,,,,,,,,,,,,,,,
,CLIO Hug Blur Tint 3.1g,,,,,,,,,,,,,,,,,,,,,,,,,,,,,,,,,,,,,,,,,,,,,,,,,,,,,,,,,,,,,,,,,,,,,,,,,,,,,
,CLIO CRYSTAL GLAM TINT SET (HARRY POTTER COLLABO) (+HONEYDUEK KEY RING AND PEN),,,,,,,,,,,,,,,,,,,,,,,,,,,,,,,,,,,,,,,,,,,,,,,,,,,,,,,,,,,,,,,,,,,,,,,,,,,,,
,CLIO Wake Up Primer Blur,,,,,,,,,,,,,,,,,,,,,,,,,,,,,,,,,,,,,,,,,,,,,,,,,,,,,,,,,,,,,,,,,,,,,,,,,,,,,
,CLIO PRO EYE PALETTE AIR (HARRY POTTER COLLABO) (+MARAUDER'S MAP POUCH),,,,,,,,,,,,,,,,,,,,,,,,,,,,,,,,,,,,,,,,,,,,,,,,,,,,,,,,,,,,,,,,,,,,,,,,,,,,,
,CNP Professional Vita-C Energy Ampoule 50mL Special Set,,,,,,,,,,,,,,,,,,,,,,,,,,,,,,,,,,,,,,,,,,,,,,,,,,,,,,,,,,,,,,,,,,,,,,,,,,,,,
,CNP Laboratory Professional Solution Vita-C Energy Ampule 50mL,,,,,,,,,,,,,,,,,,,,,,,,,,,,,,,,,,,,,,,,,,,,,,,,,,,,,,,,,,,,,,,,,,,,,,,,,,,,,
,Centellian24 Medeca Homme 2pcs Special Set (Toner 150mL + After-shave Cream 50mL + Cleansing Foam 50mL),,,,,,,,,,,,,,,,,,,,,,,,,,,,,,,,,,,,,,,,,,,,,,,,,,,,,,,,,,,,,,,,,,,,,,,,,,,,,
,COSRX Full Fit Propolis Synergy Toner 280ml Set (+Cotton Pad 40ea),,,,,,,,,,,,,,,,,,,,,,,,,,,,,,,,,,,,,,,,,,,,,,,,,,,,,,,,,,,,,,,,,,,,,,,,,,,,,
,COSRX Ultra-Light Invisible Sunscreen 50ml double set,,,,,,,,,,,,,,,,,,,,,,,,,,,,,,,,,,,,,,,,,,,,,,,,,,,,,,,,,,,,,,,,,,,,,,,,,,,,,
,COSRX Ultra-Light Invisible Sunscreen 50ml Set (+Peptide Serum 30ml),,,,,,,,,,,,,,,,,,,,,,,,,,,,,,,,,,,,,,,,,,,,,,,,,,,,,,,,,,,,,,,,,,,,,,,,,,,,,
,COSRX The Vitamin C 23 Serum 20g Set (+Peptide Skin Booster Serum 30ml+Mesh Pouch),,,,,,,,,,,,,,,,,,,,,,,,,,,,,,,,,,,,,,,,,,,,,,,,,,,,,,,,,,,,,,,,,,,,,,,,,,,,,
,_2024 Awards_ COSRX The Vitamin C 23 Serum Double Pack (+Peptdie Serum 30ml*2ea+Full Fit Sheet Mask 2ea),,,,,,,,,,,,,,,,,,,,,,,,,,,,,,,,,,,,,,,,,,,,,,,,,,,,,,,,,,,,,,,,,,,,,,,,,,,,,
,Kiss me Eye Blur Effect Tint 3.5g 02 Love-Hate,,,,,,,,,,,,,,,,,,,,,,,,,,,,,,,,,,,,,,,,,,,,,,,,,,,,,,,,,,,,,,,,,,,,,,,,,,,,,
,Kiss Me Heavy Rotation Extra Long Mascara 7g,,,,,,,,,,,,,,,,,,,,,,,,,,,,,,,,,,,,,,,,,,,,,,,,,,,,,,,,,,,,,,,,,,,,,,,,,,,,,
,LACVERT Hello Hyaluron All In One Cream 100ml 2-for-1 Set,,,,,,,,,,,,,,,,,,,,,,,,,,,,,,,,,,,,,,,,,,,,,,,,,,,,,,,,,,,,,,,,,,,,,,,,,,,,,
,LACVERT Body Exfoliator Green Tea 300ml,,,,,,,,,,,,,,,,,,,,,,,,,,,,,,,,,,,,,,,,,,,,,,,,,,,,,,,,,,,,,,,,,,,,,,,,,,,,,
,[NEW] LANEIGE Neo Essential Blurring Finish Powder 7g,,,,,,,,,,,,,,,,,,,,,,,,,,,,,,,,,,,,,,,,,,,,,,,,,,,,,,,,,,,,,,,,,,,,,,,,,,,,,
,LANEIGE Water Bank Blue Hyaluronic Intensive Cream 45mL Special Set (+10mL*2ea),,,,,,,,,,,,,,,,,,,,,,,,,,,,,,,,,,,,,,,,,,,,,,,,,,,,,,,,,,,,,,,,,,,,,,,,,,,,,
,ma:nyo Bifida Biome Ampoule Toner 400ml,,,,,,,,,,,,,,,,,,,,,,,,,,,,,,,,,,,,,,,,,,,,,,,,,,,,,,,,,,,,,,,,,,,,,,,,,,,,,
,ma:nyo Foundation-Free Sun Cream Moisture 50mL SPF50+ PA++++,,,,,,,,,,,,,,,,,,,,,,,,,,,,,,,,,,,,,,,,,,,,,,,,,,,,,,,,,,,,,,,,,,,,,,,,,,,,,
,ma:nyo Purifying Cleansing Soda Foam 150mL,,,,,,,,,,,,,,,,,,,,,,,,,,,,,,,,,,,,,,,,,,,,,,,,,,,,,,,,,,,,,,,,,,,,,,,,,,,,,
,ma:nyo Pure & Deep Cleansing Foam 160ml Double Pack,,,,,,,,,,,,,,,,,,,,,,,,,,,,,,,,,,,,,,,,,,,,,,,,,,,,,,,,,,,,,,,,,,,,,,,,,,,,,
,ma:nyo Pure Cleansing Oil 200ml,,,,,,,,,,,,,,,,,,,,,,,,,,,,,,,,,,,,,,,,,,,,,,,,,,,,,,,,,,,,,,,,,,,,,,,,,,,,,
,ma:nyo Pure Cleansing Oil 300mL Special Set (+25mL*2ea),,,,,,,,,,,,,,,,,,,,,,,,,,,,,,,,,,,,,,,,,,,,,,,,,,,,,,,,,,,,,,,,,,,,,,,,,,,,,
,makeprem Inteca Trouble Soothing Pad 70P,,,,,,,,,,,,,,,,,,,,,,,,,,,,,,,,,,,,,,,,,,,,,,,,,,,,,,,,,,,,,,,,,,,,,,,,,,,,,
,makeprem End Pore Vegetinol Tightening Serum 50mL Special Set (+Inteca Cream 31mL),,,,,,,,,,,,,,,,,,,,,,,,,,,,,,,,,,,,,,,,,,,,,,,,,,,,,,,,,,,,,,,,,,,,,,,,,,,,,
,makeprem Inteca Soothing Cream 70ml Set (+Cream 31ml*2ea),,,,,,,,,,,,,,,,,,,,,,,,,,,,,,,,,,,,,,,,,,,,,,,,,,,,,,,,,,,,,,,,,,,,,,,,,,,,,
,[BEBE] makeprem Safe Me Amino Refresh Cleansing Balm 100ml Set (+20ml+BEBE THE ORI Cleansing Band),,,,,,,,,,,,,,,,,,,,,,,,,,,,,,,,,,,,,,,,,,,,,,,,,,,,,,,,,,,,,,,,,,,,,,,,,,,,,
,makeprem Safe Me Amino Refresh Cleansing Balm 100ml Set (+20ml),,,,,,,,,,,,,,,,,,,,,,,,,,,,,,,,,,,,,,,,,,,,,,,,,,,,,,,,,,,,,,,,,,,,,,,,,,,,,
,Mamonde Rose Water Toner 250mL + 50mL Special Set (Free Gift: Cotton Pads),,,,,,,,,,,,,,,,,,,,,,,,,,,,,,,,,,,,,,,,,,,,,,,,,,,,,,,,,,,,,,,,,,,,,,,,,,,,,
,Mamonde Probiotics Ceramide Intense Cream 60mL Special Set (+30mL),,,,,,,,,,,,,,,,,,,,,,,,,,,,,,,,,,,,,,,,,,,,,,,,,,,,,,,,,,,,,,,,,,,,,,,,,,,,,
,Mamonde Amazing Deep Mint Cleansing Foam 120mL,,,,,,,,,,,,,,,,,,,,,,,,,,,,,,,,,,,,,,,,,,,,,,,,,,,,,,,,,,,,,,,,,,,,,,,,,,,,,
,MEDI-PEEL Hyaluron Layer Mooltox Ampoule 30mL Double Set,,,,,,,,,,,,,,,,,,,,,,,,,,,,,,,,,,,,,,,,,,,,,,,,,,,,,,,,,,,,,,,,,,,,,,,,,,,,,
,MEDI-PEEL Red Lacto Collagen Clear 2.0 Special Set (300mL+Deep Cleansing Sponge),,,,,,,,,,,,,,,,,,,,,,,,,,,,,,,,,,,,,,,,,,,,,,,,,,,,,,,,,,,,,,,,,,,,,,,,,,,,,
,[MINDLEMAUM EDITION] MEDI-PEEL Green Cica Collagen Clear Foam 2.0 300ml Set (+Red Lacto Foam 15ml),,,,,,,,,,,,,,,,,,,,,,,,,,,,,,,,,,,,,,,,,,,,,,,,,,,,,,,,,,,,,,,,,,,,,,,,,,,,,
,medicube Zero Pore Pad 2.0 70P Refill Set,,,,,,,,,,,,,,,,,,,,,,,,,,,,,,,,,,,,,,,,,,,,,,,,,,,,,,,,,,,,,,,,,,,,,,,,,,,,,
,Medicube Deep Vita C Pad 70P Set (+Refill 70P),,,,,,,,,,,,,,,,,,,,,,,,,,,,,,,,,,,,,,,,,,,,,,,,,,,,,,,,,,,,,,,,,,,,,,,,,,,,,
,medicube Collagen Night Wrapping Mask 75ml Set (+Jelly Brush),,,,,,,,,,,,,,,,,,,,,,,,,,,,,,,,,,,,,,,,,,,,,,,,,,,,,,,,,,,,,,,,,,,,,,,,,,,,,
,medicube Red Serum 2.0 30mL,,,,,,,,,,,,,,,,,,,,,,,,,,,,,,,,,,,,,,,,,,,,,,,,,,,,,,,,,,,,,,,,,,,,,,,,,,,,,
,[Pick Your Own] MEDIHEAL Collagen Ampoule Pad 100P Double Set,,,,,,,,,,,,,,,,,,,,,,,,,,,,,,,,,,,,,,,,,,,,,,,,,,,,,,,,,,,,,,,,,,,,,,,,,,,,,
,[Pick Your Own] MEDIHEAL Madecassoside Blemish Pad 100Pads Double Set,,,,,,,,,,,,,,,,,,,,,,,,,,,,,,,,,,,,,,,,,,,,,,,,,,,,,,,,,,,,,,,,,,,,,,,,,,,,,
,MEDIHEAL Moisture Calming Sun Cream 50g Tea Tree,,,,,,,,,,,,,,,,,,,,,,,,,,,,,,,,,,,,,,,,,,,,,,,,,,,,,,,,,,,,,,,,,,,,,,,,,,,,,
,MEDIHEAL Madecassoside Essential Mask Sheet Blemish Repair 10ea Set (+1ea) (OY-Exclusive),,,,,,,,,,,,,,,,,,,,,,,,,,,,,,,,,,,,,,,,,,,,,,,,,,,,,,,,,,,,,,,,,,,,,,,,,,,,,
,MEDIHEAL Hyaluronate Watermide Essential Mask Sheet 10ea,,,,,,,,,,,,,,,,,,,,,,,,,,,,,,,,,,,,,,,,,,,,,,,,,,,,,,,,,,,,,,,,,,,,,,,,,,,,,
,MEDIHEAL Derma Synergy Wrapping Mask Sheet for Toning Care 4P,,,,,,,,,,,,,,,,,,,,,,,,,,,,,,,,,,,,,,,,,,,,,,,,,,,,,,,,,,,,,,,,,,,,,,,,,,,,,
,Mise-en-scene Perfect Serum 110mL + 30mL Special Set [Original / Styling],,,,,,,,,,,,,,,,,,,,,,,,,,,,,,,,,,,,,,,,,,,,,,,,,,,,,,,,,,,,,,,,,,,,,,,,,,,,,
,Treatment 180mL*2ea Set (NEW),,,,,,,,,,,,,,,,,,,,,,,,,,,,,,,,,,,,,,,,,,,,,,,,,,,,,,,,,,,,,,,,,,,,,,,,,,,,,
,Mise-en-scene Original Serum Conditioner 530mL,,,,,,,,,,,,,,,,,,,,,,,,,,,,,,,,,,,,,,,,,,,,,,,,,,,,,,,,,,,,,,,,,,,,,,,,,,,,,
,Mise-en-scene Styling Serum Conditioner 530mL,,,,,,,,,,,,,,,,,,,,,,,,,,,,,,,,,,,,,,,,,,,,,,,,,,,,,,,,,,,,,,,,,,,,,,,,,,,,,
,mixsoon Bean Toner 300ml,,,,,,,,,,,,,,,,,,,,,,,,,,,,,,,,,,,,,,,,,,,,,,,,,,,,,,,,,,,,,,,,,,,,,,,,,,,,,
,mixsoon Bean Sun Stick 15g,,,,,,,,,,,,,,,,,,,,,,,,,,,,,,,,,,,,,,,,,,,,,,,,,,,,,,,,,,,,,,,,,,,,,,,,,,,,,
,mixsoon Bean Sun Stick 15g,,,,,,,,,,,,,,,,,,,,,,,,,,,,,,,,,,,,,,,,,,,,,,,,,,,,,,,,,,,,,,,,,,,,,,,,,,,,,
,mixsoon Cica-Hyal Sun Stick 15g,,,,,,,,,,,,,,,,,,,,,,,,,,,,,,,,,,,,,,,,,,,,,,,,,,,,,,,,,,,,,,,,,,,,,,,,,,,,,
,mixsoon Centella Sun Cream 50ml Set (+5ml*2ea),,,,,,,,,,,,,,,,,,,,,,,,,,,,,,,,,,,,,,,,,,,,,,,,,,,,,,,,,,,,,,,,,,,,,,,,,,,,,
,mixsoon Bean Essence 50mL,,,,,,,,,,,,,,,,,,,,,,,,,,,,,,,,,,,,,,,,,,,,,,,,,,,,,,,,,,,,,,,,,,,,,,,,,,,,,
,NAMING. Layered Fit Cushion Refill Set 12g + 12g (Main + Refill),,,,,,,,,,,,,,,,,,,,,,,,,,,,,,,,,,,,,,,,,,,,,,,,,,,,,,,,,,,,,,,,,,,,,,,,,,,,,
,NATURE REPUBLIC Intense Multi Collagen Mucin Daily Mask Sheet 30P,,,,,,,,,,,,,,,,,,,,,,,,,,,,,,,,,,,,,,,,,,,,,,,,,,,,,,,,,,,,,,,,,,,,,,,,,,,,,
,numbuzin No. 1 Clear Filter Sun Essence SPF50+ PA++++,,,,,,,,,,,,,,,,,,,,,,,,,,,,,,,,,,,,,,,,,,,,,,,,,,,,,,,,,,,,,,,,,,,,,,,,,,,,,
,numbuzin No.2 Water Collagen 65% Voluming Sheet Mask,,,,,,,,,,,,,,,,,,,,,,,,,,,,,,,,,,,,,,,,,,,,,,,,,,,,,,,,,,,,,,,,,,,,,,,,,,,,,
,numbuzin No. 3 Tingle Pore Softening Sheet Mask,,,,,,,,,,,,,,,,,,,,,,,,,,,,,,,,,,,,,,,,,,,,,,,,,,,,,,,,,,,,,,,,,,,,,,,,,,,,,
,numbuzin No. 4 Icy Soothing Sheet Mask,,,,,,,,,,,,,,,,,,,,,,,,,,,,,,,,,,,,,,,,,,,,,,,,,,,,,,,,,,,,,,,,,,,,,,,,,,,,,
,numbuzin No. 1 Pantothenic B5 Active Soothing Serum 50ml Refill Set,,,,,,,,,,,,,,,,,,,,,,,,,,,,,,,,,,,,,,,,,,,,,,,,,,,,,,,,,,,,,,,,,,,,,,,,,,,,,
,ONDO SKIN CLOTHO TONER 150ml,,,,,,,,,,,,,,,,,,,,,,,,,,,,,,,,,,,,,,,,,,,,,,,,,,,,,,,,,,,,,,,,,,,,,,,,,,,,,
,Ondo Skin Clotho Eye Cream 35ml,,,,,,,,,,,,,,,,,,,,,,,,,,,,,,,,,,,,,,,,,,,,,,,,,,,,,,,,,,,,,,,,,,,,,,,,,,,,,
,PHYSIOGEL DMT Essence In Toner 200ml,,,,,,,,,,,,,,,,,,,,,,,,,,,,,,,,,,,,,,,,,,,,,,,,,,,,,,,,,,,,,,,,,,,,,,,,,,,,,
,PHYSIOGEL Red Soothing AI Lotion 200mL,,,,,,,,,,,,,,,,,,,,,,,,,,,,,,,,,,,,,,,,,,,,,,,,,,,,,,,,,,,,,,,,,,,,,,,,,,,,,
,PHYSIOGEL DMT Facial Lotion 200ml,,,,,,,,,,,,,,,,,,,,,,,,,,,,,,,,,,,,,,,,,,,,,,,,,,,,,,,,,,,,,,,,,,,,,,,,,,,,,
,PHYSIOGEL DMT Mild Lip Balm 4.2g,,,,,,,,,,,,,,,,,,,,,,,,,,,,,,,,,,,,,,,,,,,,,,,,,,,,,,,,,,,,,,,,,,,,,,,,,,,,,
,PHYSIOGEL DMT Facial Cream 75ml,,,,,,,,,,,,,,,,,,,,,,,,,,,,,,,,,,,,,,,,,,,,,,,,,,,,,,,,,,,,,,,,,,,,,,,,,,,,,
,PHYSIOGEL DMT Regenerative Cream 50ml,,,,,,,,,,,,,,,,,,,,,,,,,,,,,,,,,,,,,,,,,,,,,,,,,,,,,,,,,,,,,,,,,,,,,,,,,,,,,
,PHYSIOGEL DMT Facial Cream 150ml,,,,,,,,,,,,,,,,,,,,,,,,,,,,,,,,,,,,,,,,,,,,,,,,,,,,,,,,,,,,,,,,,,,,,,,,,,,,,
,PHYSIOGEL DMT Hydro Gel Cream 70mL,,,,,,,,,,,,,,,,,,,,,,,,,,,,,,,,,,,,,,,,,,,,,,,,,,,,,,,,,,,,,,,,,,,,,,,,,,,,,
